{
  "schema_version": 1,
  "subject_id": "phase5-elevated",
  "risk_tier": "elevated",
  "goal": "Verify the release candidate against the frozen acceptance criteria.",
  "acceptance_criteria": [
    "criterion-clean-context",
    "criterion-tests-pass"
  ],
  "artifact_refs": [
    "artifact/patch.diff#sha256:ee1657faa015b0def7fcd2471400b441e56a733612c940f75fd30846771eee35"
  ],
  "evidence_refs": [
    "evidence/tests.json#sha256:06f9ab54361509e04fdee2fd8f43b97dbcc69861ba07c44762b7eb1e5e94cd62"
  ],
  "known_constraints": [
    "Network verification is out of scope."
  ],
  "package_digest": "sha256:cac8d740d4774b7320ccd511e1a537797d594c8b35bfe8abec584f2b697519e3"
}
